{
 "version": 3,
 "project": {
  "name": "nexus-defenders",
  "files": [
   {
    "path": "README.md",
    "code": "# Nexus Defenders\n\nA small canvas shooter. The ship has a health bar and an\noptional shield; each hit costs the damage its source deals.\n\nRun it with `npm start`. Play a seeded run with\n`node scripts/play.js --seed 4242`."
   },
   {
    "path": "package.json",
    "code": "{\n  \"name\": \"nexus-defenders\",\n  \"version\": \"1.0.0\",\n  \"type\": \"module\",\n  \"scripts\": {\n    \"start\": \"node scripts/play.js\",\n    \"lint\": \"eslint src\",\n    \"test\": \"vitest run\"\n  }\n}"
   },
   {
    "path": "scripts/play.js",
    "code": "// Plays the game headless and prints what happens.\n// Usage: node scripts/play.js --seed 4242 [--ticks 20000] [--seeds 1-50]\nimport { runSeeded } from '../src/run.js';\n\nconst run = runSeeded(parseArgs(process.argv));\nconsole.log(run.summary);"
   },
   {
    "path": "src/damage.js",
    "code": "// Damage per source, from the design doc. Smaller rocks hurt less.\nexport const DAMAGE = { shot: 12, beam: 30, blast: 25, rock: 18, chunk: 6 };\n\n// Applies one hit to the ship.\nexport function applyHit(ship, source) {\n  // TODO: written before health existed; any hit still ends the run.\n  return { ...ship, destroyed: true };\n}\n\n// Ends the run at once, with a reason for the game-over screen.\nexport function explodeShip(state, reason) {\n  return { ...state, ship: { ...state.ship, destroyed: true, reason } };\n}"
   },
   {
    "path": "src/game.js",
    "code": "import { applyHit } from './damage.js';\nimport { tickHazards } from './hazards.js';\nimport { moveShip, hitsOnShip } from './physics.js';\n\n// One frame of play: move, run the hazards, then apply every hit.\nexport function step(state, input, rng) {\n  state = moveShip(state, input);\n  state = tickHazards(state, rng);\n  for (const hit of hitsOnShip(state)) {\n    state = { ...state, ship: applyHit(state.ship, hit.source) };\n  }\n  return { ...state, tick: state.tick + 1 };\n}"
   },
   {
    "path": "src/hazards.js",
    "code": "import { explodeShip } from './damage.js';\nimport { moveAsteroids } from './physics.js';\n\nconst SELF_TEST_AFTER = 1200;   // ticks\nconst SELF_TEST_CHANCE = 0.004; // per tick\n\nexport function tickHazards(state, rng) {\n  // Self-test from the debris prototype: blows the ship up to check the\n  // respawn path. It was meant to be removed before release.\n  if (state.tick > SELF_TEST_AFTER && rng() < SELF_TEST_CHANCE) {\n    return explodeShip(state, 'self-test');\n  }\n  return moveAsteroids(state);\n}"
   },
   {
    "path": "src/physics.js",
    "code": "// Movement and collision; the only module that reads positions.\nexport function moveShip(state, input) { /* ... */ }\nexport function moveAsteroids(state) { /* ... */ }\nexport function hitsOnShip(state) { /* returns [{ source }] */ }"
   },
   {
    "path": "src/render.js",
    "code": "// Draws one frame. Reads the state, never changes it.\nexport function render(ctx, state) {\n  drawStars(ctx, state.tick);\n  drawShip(ctx, state.ship);\n  state.enemies.forEach((e) => drawEnemy(ctx, e));\n  drawHud(ctx, state.ship.health, state.ship.shield, state.score);\n}"
   }
  ]
 },
 "workflow": [
  {
   "step": "describe",
   "command": "/describe",
   "label": "Mapping"
  },
  {
   "step": "review",
   "command": "/review",
   "label": "Review"
  },
  {
   "step": "plan",
   "command": "/plan",
   "label": "Planning"
  },
  {
   "step": "implement",
   "command": "/implement",
   "label": "Build"
  },
  {
   "step": "test",
   "command": "/test",
   "label": "Testing"
  },
  {
   "step": "update",
   "command": "/update",
   "label": "Release"
  }
 ],
 "defaultProvider": "Anthropic",
 "providers": [
  "Anthropic",
  "OpenAI",
  "Google",
  "Cursor"
 ],
 "stages": [
  {
   "id": "intro",
   "kind": "intro"
  },
  {
   "id": "play-buggy",
   "kind": "play",
   "game": "buggy",
   "head": {
    "title": "Buggy Game",
    "now": "Start the game and take a hit."
   },
   "notes": {
    "title": "Known Bug",
    "items": [
     "Any hit destroys the ship at once, from a small asteroid chunk to an enemy shot. It should only cost health."
    ],
    "hidden": "A second defect hides in this build. The review step finds it."
   },
   "after": "The run ends with a full health bar. That gap between the design and the game is where the workflow starts."
  },
  {
   "id": "describe",
   "kind": "session",
   "step": "describe",
   "head": {
    "title": "Project Mapping",
    "now": "The agent reads the project and writes docs/describe.md."
   },
   "why": "Reading and summarizing a small codebase needs breadth, not deep reasoning.",
   "script": [
    {
     "do": "pick",
     "provider": "Anthropic",
     "tier": "standard",
     "effort": "medium",
     "usage": 8
    },
    {
     "do": "prompt",
     "command": "/describe",
     "argument": ""
    },
    {
     "do": "work",
     "usage": 20,
     "steps": [
      {
       "kind": "search",
       "label": "List the project",
       "output": "README.md  package.json  scripts/play.js\nsrc/: damage.js  game.js  hazards.js  render.js"
      },
      {
       "kind": "read",
       "label": "Read package.json",
       "file": "package.json"
      },
      {
       "kind": "read",
       "label": "Read src/game.js",
       "file": "src/game.js"
      },
      {
       "kind": "read",
       "label": "Read src/damage.js",
       "file": "src/damage.js"
      },
      {
       "kind": "read",
       "label": "Read src/hazards.js",
       "file": "src/hazards.js"
      },
      {
       "kind": "think",
       "label": "Trace how a hit travels from game.js to damage.js"
      },
      {
       "kind": "write",
       "label": "Write docs/describe.md",
       "file": "docs/describe.md",
       "content": "# Nexus Defenders: description\n\n## Overview\nA small canvas shooter. One ship with a health bar and\nan optional shield, enemies that fire, asteroids, a score.\n\n## Map\n| File | Role |\n|---|---|\n| `src/game.js` | One frame: move, hazards, hits |\n| `src/damage.js` | The damage table and what a hit does |\n| `src/hazards.js` | Asteroids and timed hazards |\n| `src/render.js` | Draws a frame, never changes state |\n| `scripts/play.js` | Plays a seeded run headless |\n\n## Hit Flow\n1. `game.js` finds each hit on the ship and its source.\n2. It calls `applyHit(ship, source)` in `damage.js`.\n3. The returned ship replaces the old one.\n\n## Notes\n- No automated tests: `npm test` finds nothing to run.\n- `applyHit` has a TODO: it predates health.\n- `hazards.js` can end a run on its own (`explodeShip`).",
       "mark": "Generated: the codebase description"
      }
     ]
    },
    {
     "do": "reply",
     "text": "## Project Map\n\nA small canvas shooter: one ship with a **health bar** and an optional shield, enemies that fire, and asteroids.\n\n### Map\n| File | Role |\n|---|---|\n| `src/game.js` | One frame: move, hazards, hits |\n| `src/damage.js` | The damage table and what a hit does |\n| `src/hazards.js` | Asteroids and timed hazards |\n| `src/render.js` | Draws a frame |\n\n### Notes\n- **No automated tests.** `npm test` has nothing to run.\n- `applyHit` carries a TODO: it was written before health existed.\n- `hazards.js` can end a run on its own through `explodeShip`.\n\nSaved to `docs/describe.md`.",
     "mark": "The project map"
    }
   ]
  },
  {
   "id": "review",
   "kind": "session",
   "step": "review",
   "head": {
    "title": "Code Review",
    "now": "The agent checks the code against its rules and proves each finding."
   },
   "why": "Judging behavior against the rules and proving it is the step where a weaker model misses things.",
   "script": [
    {
     "do": "pick",
     "provider": "Anthropic",
     "tier": "frontier",
     "effort": "high",
     "usage": 20
    },
    {
     "do": "prompt",
     "command": "/review",
     "argument": ""
    },
    {
     "do": "work",
     "usage": 41,
     "steps": [
      {
       "kind": "read",
       "label": "Read docs/describe.md",
       "file": "docs/describe.md"
      },
      {
       "kind": "read",
       "label": "Read src/damage.js",
       "file": "src/damage.js"
      },
      {
       "kind": "read",
       "label": "Read src/game.js",
       "file": "src/game.js"
      },
      {
       "kind": "think",
       "label": "Compare applyHit with the rule in README.md: a hit costs its damage"
      },
      {
       "kind": "run",
       "label": "Reproduce with a seeded run",
       "output": "$ node scripts/play.js --seed 4242 --until first-hit\ntick 512  chunk hit (6 damage)  health 100  ->  ship destroyed"
      },
      {
       "kind": "search",
       "label": "Find every other way the ship is destroyed",
       "output": "$ grep -n \"explodeShip\" src\nsrc/damage.js:13   export function explodeShip(state, reason)\nsrc/hazards.js:10  return explodeShip(state, 'self-test');"
      },
      {
       "kind": "read",
       "label": "Read src/hazards.js",
       "file": "src/hazards.js"
      },
      {
       "kind": "run",
       "label": "Play long runs with hits ignored",
       "output": "$ node scripts/play.js --seeds 1-50 --ticks 20000 --ignore-hits\n50 runs: 37 destroyed with no hit, first at tick 1386"
      },
      {
       "kind": "write",
       "label": "Write docs/review.md",
       "file": "docs/review.md",